{
  "evaluation_status": "COMPLETE",
  "model_id": "unet-dual-pol-sar-v4",
  "model_version": "V4",
  "model_status": "experimental",
  "checkpoint": {
    "path": "ml/model_registry/versions/unet_dual_pol_sar_v4.pth",
    "sha256": "c1395f1deae819b222f9e1034472d18a84f502fd89d4076981d3291f4af4fd63",
    "size_bytes": 4367239,
    "load_status": "PASSED"
  },
  "preprocessing": {
    "name": "Decibel_Calibrated_Clipping",
    "vv_range_db": [
      -35.0,
      -5.0
    ],
    "vh_range_db": [
      -45.0,
      -15.0
    ],
    "formula": "clip((value_db - min_db) / (max_db - min_db), 0, 1)",
    "channel_order": [
      "VV",
      "VH"
    ],
    "invalid_handling": "fill_zero",
    "verified": true
  },
  "dataset": {
    "name": "data/raw/satellite/dataset_manifest.json",
    "split": "test",
    "availability": true,
    "leakage_status": "LEAKAGE_STATUS: VERIFIED_DISJOINT_SCENE_LEVEL_SPLITS",
    "total_scenes_evaluated": 5,
    "categories_present": [
      "test_set"
    ]
  },
  "device": "cuda:0",
  "evaluation_parameters": {
    "tile_size": 512,
    "stride": 512
  },
  "thresholds": [
    {
      "threshold": 0.3,
      "iou": 0.012252,
      "dice": 0.024207,
      "precision": 0.012337,
      "recall": 0.639247,
      "overall_fpr": 0.505821,
      "clean_ocean_fpr": "CLASS_SEPARATION_NOT_AVAILABLE",
      "look_alike_fpr": "CLASS_SEPARATION_NOT_AVAILABLE",
      "confusion_matrix": {
        "tp": 131210,
        "fp": 10504020,
        "fn": 74047,
        "tn": 10262243
      }
    },
    {
      "threshold": 0.35,
      "iou": 0.013875,
      "dice": 0.027371,
      "precision": 0.014055,
      "recall": 0.521054,
      "overall_fpr": 0.361293,
      "clean_ocean_fpr": "CLASS_SEPARATION_NOT_AVAILABLE",
      "look_alike_fpr": "CLASS_SEPARATION_NOT_AVAILABLE",
      "confusion_matrix": {
        "tp": 106950,
        "fp": 7502702,
        "fn": 98307,
        "tn": 13263561
      }
    },
    {
      "threshold": 0.4,
      "iou": 0.01515,
      "dice": 0.029848,
      "precision": 0.01548,
      "recall": 0.415806,
      "overall_fpr": 0.261389,
      "clean_ocean_fpr": "CLASS_SEPARATION_NOT_AVAILABLE",
      "look_alike_fpr": "CLASS_SEPARATION_NOT_AVAILABLE",
      "confusion_matrix": {
        "tp": 85347,
        "fp": 5428077,
        "fn": 119910,
        "tn": 15338186
      }
    },
    {
      "threshold": 0.45,
      "iou": 0.015483,
      "dice": 0.030493,
      "precision": 0.015874,
      "recall": 0.385565,
      "overall_fpr": 0.23626,
      "clean_ocean_fpr": "CLASS_SEPARATION_NOT_AVAILABLE",
      "look_alike_fpr": "CLASS_SEPARATION_NOT_AVAILABLE",
      "confusion_matrix": {
        "tp": 79140,
        "fp": 4906241,
        "fn": 126117,
        "tn": 15860022
      }
    },
    {
      "threshold": 0.5,
      "iou": 0.015798,
      "dice": 0.031105,
      "precision": 0.016255,
      "recall": 0.360022,
      "overall_fpr": 0.215361,
      "clean_ocean_fpr": "CLASS_SEPARATION_NOT_AVAILABLE",
      "look_alike_fpr": "CLASS_SEPARATION_NOT_AVAILABLE",
      "confusion_matrix": {
        "tp": 73897,
        "fp": 4472237,
        "fn": 131360,
        "tn": 16294026
      }
    },
    {
      "threshold": 0.6,
      "iou": 0.01672,
      "dice": 0.03289,
      "precision": 0.01734,
      "recall": 0.318688,
      "overall_fpr": 0.178513,
      "clean_ocean_fpr": "CLASS_SEPARATION_NOT_AVAILABLE",
      "look_alike_fpr": "CLASS_SEPARATION_NOT_AVAILABLE",
      "confusion_matrix": {
        "tp": 65413,
        "fp": 3707054,
        "fn": 139844,
        "tn": 17059209
      }
    }
  ],
  "execution_metadata": {
    "evaluated_at": "2026-09-19T05:06:17.459849+00:00",
    "duration_seconds": 2.51
  }
}