{
  "evaluation_status": "COMPLETE",
  "model_id": "unet-dual-pol-sar-v2",
  "model_version": "V2",
  "model_status": "trained",
  "checkpoint": {
    "path": "ml/model_registry/versions/unet_dual_pol_sar_v2.pth",
    "sha256": "905ef8e47c1f4b12eb490b33f1726fb91714b3dfcdf5184d8dfd96ec312f0dbd",
    "size_bytes": 13066175,
    "load_status": "PASSED"
  },
  "preprocessing": {
    "name": "Historical_Uncorrected_Positive_Mask",
    "vv_range_db": "NOT_CALIBRATED (clipped > 0)",
    "vh_range_db": "NOT_CALIBRATED (clipped > 0)",
    "formula": "arr * (arr > 0)",
    "channel_order": [
      "VV",
      "VH"
    ],
    "invalid_handling": "clipped_to_zero",
    "verified": true,
    "note": "Historical baseline with negative dB truncation."
  },
  "dataset": {
    "name": "data/raw/satellite/dataset_manifest.json",
    "split": "test",
    "availability": true,
    "leakage_status": "LEAKAGE_STATUS: VERIFIED_DISJOINT_SCENE_LEVEL_SPLITS",
    "total_scenes_evaluated": 5,
    "categories_present": [
      "test_set"
    ]
  },
  "device": "cuda:0",
  "evaluation_parameters": {
    "tile_size": 512,
    "stride": 512
  },
  "thresholds": [
    {
      "threshold": 0.3,
      "iou": 0.008454,
      "dice": 0.016766,
      "precision": 0.025034,
      "recall": 0.012604,
      "overall_fpr": 0.004852,
      "clean_ocean_fpr": "CLASS_SEPARATION_NOT_AVAILABLE",
      "look_alike_fpr": "CLASS_SEPARATION_NOT_AVAILABLE",
      "confusion_matrix": {
        "tp": 2587,
        "fp": 100752,
        "fn": 202670,
        "tn": 20665511
      }
    },
    {
      "threshold": 0.35,
      "iou": 0.004187,
      "dice": 0.008339,
      "precision": 0.118742,
      "recall": 0.004321,
      "overall_fpr": 0.000317,
      "clean_ocean_fpr": "CLASS_SEPARATION_NOT_AVAILABLE",
      "look_alike_fpr": "CLASS_SEPARATION_NOT_AVAILABLE",
      "confusion_matrix": {
        "tp": 887,
        "fp": 6583,
        "fn": 204370,
        "tn": 20759680
      }
    },
    {
      "threshold": 0.4,
      "iou": 0.0,
      "dice": 0.0,
      "precision": 0.0,
      "recall": 0.0,
      "overall_fpr": 1.4e-05,
      "clean_ocean_fpr": "CLASS_SEPARATION_NOT_AVAILABLE",
      "look_alike_fpr": "CLASS_SEPARATION_NOT_AVAILABLE",
      "confusion_matrix": {
        "tp": 0,
        "fp": 294,
        "fn": 205257,
        "tn": 20765969
      }
    },
    {
      "threshold": 0.45,
      "iou": 0.0,
      "dice": 0.0,
      "precision": 0.0,
      "recall": 0.0,
      "overall_fpr": 1e-05,
      "clean_ocean_fpr": "CLASS_SEPARATION_NOT_AVAILABLE",
      "look_alike_fpr": "CLASS_SEPARATION_NOT_AVAILABLE",
      "confusion_matrix": {
        "tp": 0,
        "fp": 200,
        "fn": 205257,
        "tn": 20766063
      }
    },
    {
      "threshold": 0.5,
      "iou": 0.0,
      "dice": 0.0,
      "precision": 0.0,
      "recall": 0.0,
      "overall_fpr": 8e-06,
      "clean_ocean_fpr": "CLASS_SEPARATION_NOT_AVAILABLE",
      "look_alike_fpr": "CLASS_SEPARATION_NOT_AVAILABLE",
      "confusion_matrix": {
        "tp": 0,
        "fp": 170,
        "fn": 205257,
        "tn": 20766093
      }
    },
    {
      "threshold": 0.6,
      "iou": 0.0,
      "dice": 0.0,
      "precision": 0.0,
      "recall": 0.0,
      "overall_fpr": 7e-06,
      "clean_ocean_fpr": "CLASS_SEPARATION_NOT_AVAILABLE",
      "look_alike_fpr": "CLASS_SEPARATION_NOT_AVAILABLE",
      "confusion_matrix": {
        "tp": 0,
        "fp": 137,
        "fn": 205257,
        "tn": 20766126
      }
    }
  ],
  "execution_metadata": {
    "evaluated_at": "2026-09-19T05:06:14.931384+00:00",
    "duration_seconds": 3.21
  }
}